{"collection":"Magic: The Gathering | Marvel Super Heroes Jumpstart","setCode":"MSH","group":"R","decks":[{"id":"boosted","name":"Boosted","group":"R","colors":["R"],"description":"Im Spielverlauf immer größere Power-Schübe aufbauen.","cards":[{"name":"Quinjet Technician","qty":1},{"name":"Extremis Elite","qty":1},{"name":"Marvel Boy, Noh-Varr","qty":1},{"name":"Jack of Hearts, Volatile Hero","qty":1},{"name":"Molly Hayes, Runaway","qty":1},{"name":"Human Torch, Johnny Storm","qty":1},{"name":"Abomination, Terrifying Titan","qty":1},{"name":"Wonder Man, Hollywood Hero","qty":1},{"name":"Heroes' Hangout","qty":1},{"name":"Vision of Love","qty":1},{"name":"HULK SMASH!","qty":1},{"name":"Inspired Fire","qty":1}],"lands":[{"name":"Thriving Bluff","qty":1},{"name":"Mountain","qty":7}]},{"id":"fearless","name":"Fearless","group":"R","colors":["R"],"description":"Eigenen Schaden als Ressource für starke Effekte nutzen.","cards":[{"name":"Unlucky Witness","qty":1},{"name":"Taxi Driver","qty":1},{"name":"Stick, Fearless Mentor","qty":1},{"name":"Daredevil, Fearless Fighter","qty":1},{"name":"Jessica Jones, Private Eye","qty":1},{"name":"Elektra, Femme Fatale","qty":1},{"name":"Stegron the Dinosaur Man","qty":1},{"name":"Blazing Crescendo","qty":1},{"name":"Daredevil's Billy Club","qty":1},{"name":"HULK SMASH!","qty":1},{"name":"Hire a Crew","qty":1}],"lands":[{"name":"Fogwell's Gym","qty":1},{"name":"Thriving Bluff","qty":1},{"name":"Mountain","qty":7}]},{"id":"heroes-for-hire","name":"Heroes for Hire","group":"R","colors":["R"],"description":"Treasure verdienen und für Tempo und Belohnungen ausgeben.","cards":[{"name":"Stark Industries Executive","qty":1},{"name":"K'un-Lun Warrior","qty":1},{"name":"Misty Knight, Hero for Hire","qty":1},{"name":"Iron Fist, Hero for Hire","qty":1},{"name":"Contract Hero","qty":1},{"name":"Jessica Jones, Private Eye","qty":1},{"name":"Luke Cage, Hero for Hire","qty":1},{"name":"Red Hulk","qty":1},{"name":"Bionic Blow","qty":1},{"name":"Big Score","qty":1},{"name":"Heroes for Hire","qty":1},{"name":"Marvelous Melee","qty":1}],"lands":[{"name":"Thriving Bluff","qty":1},{"name":"Mountain","qty":7}]},{"id":"runaways","name":"Runaways","group":"R","colors":["R"],"description":"Zauber aus dem Exil spielen und Runaway-Synergien aktivieren.","cards":[{"name":"Chase Stein, Runaway","qty":1},{"name":"Alex Wilder, Runaway","qty":1},{"name":"Molly Hayes, Runaway","qty":1},{"name":"Gert and Old Lace, Runaways","qty":1},{"name":"Karolina Dean, Runaway","qty":1},{"name":"Nico Minoru, Runaway","qty":1},{"name":"Victor Mancha, Runaway","qty":1},{"name":"Shock","qty":1},{"name":"Blazing Crescendo","qty":1},{"name":"Hex Magic","qty":1},{"name":"Crossover Collaboration","qty":1},{"name":"Marvelous Melee","qty":1}],"lands":[{"name":"Thriving Bluff","qty":1},{"name":"Mountain","qty":7}]},{"id":"scarlet","name":"Scarlet","group":"R","colors":["R"],"description":"Viele Zauber in einem Zug für gebündelte Synergien ketten.","cards":[{"name":"Stark Industries Executive","qty":1},{"name":"Loki Laufeyson","qty":1},{"name":"Speed, Young Avenger","qty":1},{"name":"Molten Lavamancer","qty":1},{"name":"Wiccan, Young Avenger","qty":1},{"name":"The Vision and Scarlet Witch","qty":1},{"name":"Kree Sentinel","qty":1},{"name":"Lightning Bolt","qty":1},{"name":"Vision of Love","qty":1},{"name":"Grapeshot","qty":1},{"name":"Hex Magic","qty":1},{"name":"Wanda's Vision","qty":1}],"lands":[{"name":"Thriving Bluff","qty":1},{"name":"Mountain","qty":7}]},{"id":"speedy","name":"Speedy","group":"R","colors":["R"],"description":"Mit Haste schnell und wiederholt angreifen.","cards":[{"name":"Masked Meower","qty":1},{"name":"Quicksilver, Brash Blur","qty":1},{"name":"Taxi Driver","qty":1},{"name":"Speed, Young Avenger","qty":1},{"name":"Whirlwind, Killer Cyclone","qty":1},{"name":"Volcanic Villain","qty":1},{"name":"The Whizzer, Classic Speedster","qty":1},{"name":"Living Lightning, Charged Up","qty":1},{"name":"Super Speed","qty":1},{"name":"Pick Up the Pace","qty":1},{"name":"Lightning Strike","qty":1},{"name":"Marvelous Melee","qty":1}],"lands":[{"name":"Thriving Bluff","qty":1},{"name":"Mountain","qty":7}]},{"id":"spider-verse","name":"Spider-Verse","group":"R","colors":["R"],"description":"Karten abwerfen und damit Spider-Verse-Effekte freischalten.","cards":[{"name":"Masked Meower","qty":1},{"name":"Hobgoblin, Mantled Marauder","qty":1},{"name":"Lady Spider, Maybelle Reilly","qty":1},{"name":"Spider-Gwen, Free Spirit","qty":1},{"name":"Spider-Man, New Champion","qty":1},{"name":"Iceman and Firestar","qty":1},{"name":"Astonishing Spider-Man","qty":1},{"name":"Stegron the Dinosaur Man","qty":1},{"name":"Romantic Rendezvous","qty":1},{"name":"Daily Bugle Newspaper","qty":1},{"name":"Wisecrack","qty":1},{"name":"Marvelous Melee","qty":1}],"lands":[{"name":"Thriving Bluff","qty":1},{"name":"Fogwell's Gym","qty":1},{"name":"Mountain","qty":6}]},{"id":"thor","name":"Thor","group":"R","colors":["R"],"description":"Direktschaden bündeln und Gegner mit Thors Arsenal verbrennen.","cards":[{"name":"K'un-Lun Warrior","qty":1},{"name":"Loki Laufeyson","qty":1},{"name":"Sif's Spearmaster","qty":1},{"name":"Molten Lavamancer","qty":1},{"name":"Crimson Operative","qty":1},{"name":"Thor, Asgard's Avenger","qty":1},{"name":"Kree Sentinel","qty":1},{"name":"Asgardian Inspiration","qty":1},{"name":"Lightning Bolt","qty":1},{"name":"Lightning Strike","qty":1},{"name":"Origin of Thor","qty":1},{"name":"Mjölnir's Might","qty":1}],"lands":[{"name":"Thriving Bluff","qty":1},{"name":"Mountain","qty":7}]},{"id":"vehicles","name":"Vehicles","group":"R","colors":["R"],"description":"Fahrzeuge bemannen und mit einer mobilen Flotte angreifen.","cards":[{"name":"Intrepid Ace","qty":1},{"name":"HYDRA Assault Robot","qty":1},{"name":"Extremis Elite","qty":1},{"name":"Taxi Driver","qty":1},{"name":"Machinesmith Automaton","qty":1},{"name":"Bullseye, Death Dealer","qty":1},{"name":"Captain America's Motorcycle","qty":1},{"name":"Big Wheel","qty":1},{"name":"S.H.I.E.L.D. Helicarrier","qty":1},{"name":"Sky Cycle","qty":1},{"name":"The Thanos-Copter","qty":1},{"name":"Truck Toss","qty":1}],"lands":[{"name":"Thriving Bluff","qty":1},{"name":"Mountain","qty":7}]},{"id":"young-avengers","name":"Young Avengers","group":"R","colors":["R"],"description":"Nichtkreatur-Sprüche nutzen, um Young Avengers zu aktivieren.","cards":[{"name":"Stature, Young Avenger","qty":1},{"name":"Speed, Young Avenger","qty":1},{"name":"Patriot, Young Avenger","qty":1},{"name":"Iron Lad, Young Avenger","qty":1},{"name":"Wiccan, Young Avenger","qty":1},{"name":"Hawkeye, Young Avenger","qty":1},{"name":"Hulkling, Young Avenger","qty":1},{"name":"Hawkeye's Bow","qty":1},{"name":"Team Tactics","qty":1},{"name":"Lightning Strike","qty":1},{"name":"Crossover Collaboration","qty":1},{"name":"Marvelous Melee","qty":1}],"lands":[{"name":"Thriving Bluff","qty":1},{"name":"Mountain","qty":7}]}]}
