{"collection":"Magic: The Gathering | Marvel Super Heroes Jumpstart","setCode":"MSH","group":"W","decks":[{"id":"agents-of-s-h-i-e-l-d","name":"Agents of S.H.I.E.L.D.","group":"W","colors":["W"],"description":"Einzelne Angreifer infiltrieren den Gegner und erzeugen Zusatznutzen.","cards":[{"name":"Agent Phil Coulson","qty":1},{"name":"Peggy Carter, Secret Agent","qty":1},{"name":"Agent 13, Sharon Carter","qty":1},{"name":"Agents of S.H.I.E.L.D.","qty":1},{"name":"Quake, Agent of S.H.I.E.L.D.","qty":1},{"name":"S.H.I.E.L.D. Helicarrier","qty":1},{"name":"Borough Backup","qty":1},{"name":"Nick Fury, Spymaster","qty":1},{"name":"S.H.I.E.L.D. Spy Kit","qty":1},{"name":"Helicarrier Strike","qty":1},{"name":"Strategic Intervention","qty":1},{"name":"Web Up","qty":1}],"lands":[{"name":"Thriving Heath","qty":1},{"name":"Plains","qty":7}]},{"id":"battalion","name":"Battalion","group":"W","colors":["W"],"description":"Mit breiten Angriffen ab drei Kreaturen Druck aufbauen.","cards":[{"name":"General Thunderbolt Ross","qty":1},{"name":"The Howling Commandos","qty":1},{"name":"Wakandan Shield Guard","qty":1},{"name":"Wild Pack Squad","qty":1},{"name":"Falcon, Joaquin Torres","qty":1},{"name":"War Machine, James Rhodes","qty":1},{"name":"U.S.Agent, John Walker","qty":1},{"name":"Captain America, Skybound","qty":1},{"name":"Ultimate Alliance","qty":1},{"name":"Helicarrier Strike","qty":1},{"name":"Heroic Teamwork","qty":1},{"name":"Fall to Earth","qty":1}],"lands":[{"name":"Thriving Heath","qty":1},{"name":"Plains","qty":7}]},{"id":"caretakers","name":"Caretakers","group":"W","colors":["W"],"description":"Lebenspunkte gewinnen und damit Verbündete verstärken.","cards":[{"name":"Crowd of True Believers","qty":1},{"name":"Night Nurse, Healer of Heroes","qty":1},{"name":"Donald Blake, Guise of Thor","qty":1},{"name":"MJ, Rising Star","qty":1},{"name":"Virtuous Variant","qty":1},{"name":"Doctor Jane Foster","qty":1},{"name":"Valkyrior Skyrider","qty":1},{"name":"Doctor Strange, Surgeon","qty":1},{"name":"Take Up the Shield","qty":1},{"name":"Super Villain Lockup","qty":1},{"name":"Infinity Formula","qty":1},{"name":"Fall to Earth","qty":1}],"lands":[{"name":"Thriving Heath","qty":1},{"name":"Plains","qty":7}]},{"id":"counterargument","name":"Counterargument","group":"W","colors":["W"],"description":"Mit Marken und juristischem Team das Board kontrollieren.","cards":[{"name":"City Pigeon","qty":1},{"name":"Selfless Police Captain","qty":1},{"name":"Matt Murdock, Justice Seeker","qty":1},{"name":"She-Hulk, Attorney-at-Law","qty":1},{"name":"Foggy Nelson, On Retainer","qty":1},{"name":"Daily Bugle Reporters","qty":1},{"name":"Starling, Aerial Ally","qty":1},{"name":"Vault Guardsman","qty":1},{"name":"Political Triumph","qty":1},{"name":"Costume Closet","qty":1},{"name":"Murdock's Crusade","qty":1},{"name":"Web Up","qty":1}],"lands":[{"name":"Thriving Heath","qty":1},{"name":"Plains","qty":7}]},{"id":"equipped","name":"Equipped","group":"W","colors":["W"],"description":"Ausrüstung verteilt Vorteile an Captain Americas Team.","cards":[{"name":"Bucky Barnes, Eager Ally","qty":1},{"name":"Peggy Carter, Secret Agent","qty":1},{"name":"The Howling Commandos","qty":1},{"name":"Agent 13, Sharon Carter","qty":1},{"name":"Patriot, Young Avenger","qty":1},{"name":"U.S.Agent, John Walker","qty":1},{"name":"Captain America, Liberator","qty":1},{"name":"Captain America's Shield","qty":1},{"name":"Take Up the Shield","qty":1},{"name":"Infinity Formula","qty":1},{"name":"Origin of Captain America","qty":1},{"name":"Secure Detention","qty":1}],"lands":[{"name":"Thriving Heath","qty":1},{"name":"Plains","qty":7}]},{"id":"marvelous","name":"Marvelous","group":"W","colors":["W"],"description":"Marvel-Kreaturen kurz ins Exil schicken und Eintrittseffekte wiederholen.","cards":[{"name":"Wakandan Shield Guard","qty":1},{"name":"Raft Security Officer","qty":1},{"name":"Marvel Boy, Noh-Varr","qty":1},{"name":"Hero in Training","qty":1},{"name":"Ms. Marvel, Elastic Ally","qty":1},{"name":"Photon, Lady of Light","qty":1},{"name":"Captain Mar-Vell, Space-Born","qty":1},{"name":"Captain Marvel, Shooting Star","qty":1},{"name":"Helicarrier Strike","qty":1},{"name":"Quantum Entanglement","qty":1},{"name":"Super Villain Lockup","qty":1},{"name":"Fall to Earth","qty":1}],"lands":[{"name":"Thriving Heath","qty":1},{"name":"Plains","qty":7}]},{"id":"precise","name":"Precise","group":"W","colors":["W"],"description":"Eigene Kreaturen gezielt mit Sprüchen anvisieren und Effekte auslösen.","cards":[{"name":"Colleen Wing, Street Samurai","qty":1},{"name":"Agent of Atlas","qty":1},{"name":"Raft Security Officer","qty":1},{"name":"Kree Commandos","qty":1},{"name":"Hawkeye, Bowslinger","qty":1},{"name":"Mockingbird, Ace Agent","qty":1},{"name":"Valkyrior Skyrider","qty":1},{"name":"Panther Pounce","qty":1},{"name":"Stunning Shot","qty":1},{"name":"Sudden Strike","qty":1},{"name":"Heroic Teamwork","qty":1},{"name":"Fall to Earth","qty":1}],"lands":[{"name":"Thriving Heath","qty":1},{"name":"Plains","qty":7}]},{"id":"squadron","name":"Squadron","group":"W","colors":["W"],"description":"Helden unterstützen und gemeinsam das Squadron Supreme aufbauen.","cards":[{"name":"Agent of Atlas","qty":1},{"name":"Brave Brawler","qty":1},{"name":"Nighthawk, Dark Defender","qty":1},{"name":"Hero in Training","qty":1},{"name":"Zarda, the Power Princess","qty":1},{"name":"Doctor Spectrum","qty":1},{"name":"Borough Backup","qty":1},{"name":"Hyperion, Supreme Hero","qty":1},{"name":"Hyperion's Atomic Vision","qty":1},{"name":"Heroic Teamwork","qty":1},{"name":"Web Up","qty":1},{"name":"Blur of Heroism","qty":1}],"lands":[{"name":"Thriving Heath","qty":1},{"name":"Plains","qty":7}]},{"id":"wakanda","name":"Wakanda","group":"W","colors":["W"],"description":"Viele Kreaturenspielsteine erzeugen und das Board fluten.","cards":[{"name":"Wakandan Shield Guard","qty":1},{"name":"Wakandan Tusker","qty":1},{"name":"Black Panther, Most Dangerous","qty":1},{"name":"Shuri, Vibranium Technologist","qty":1},{"name":"Okoye, Dora Milaje Leader","qty":1},{"name":"Wakandan Drone Flock","qty":1},{"name":"Borough Backup","qty":1},{"name":"Vibranium Energy Daggers","qty":1},{"name":"Ultimate Alliance","qty":1},{"name":"Panther Pounce","qty":1},{"name":"Heroic Teamwork","qty":1},{"name":"Secure Detention","qty":1}],"lands":[{"name":"Thriving Heath","qty":1},{"name":"Plains","qty":7}]},{"id":"web-slinging","name":"Web-Slinging","group":"W","colors":["W"],"description":"Kleine getappte Kreaturen gegen mächtige Spider-Heroes austauschen.","cards":[{"name":"Aunt May","qty":1},{"name":"Flash Thompson, Spider-Fan","qty":1},{"name":"Gallant Citizen","qty":1},{"name":"Spider-Man, Web-Slinger","qty":1},{"name":"Virtuous Variant","qty":1},{"name":"Spider-UK","qty":1},{"name":"Amazing Spider-Girl","qty":1},{"name":"Vault Guardsman","qty":1},{"name":"Thwip!","qty":1},{"name":"Spectacular Tactics","qty":1},{"name":"Web Up","qty":1},{"name":"Spider-Mobile","qty":1}],"lands":[{"name":"Thriving Heath","qty":1},{"name":"Plains","qty":7}]}]}
