{"collection":"Magic: The Gathering | Marvel Super Heroes Jumpstart","setCode":"MSH","group":"G","decks":[{"id":"animal","name":"Animal","group":"G","colors":["G"],"description":"Lebenspunkte gewinnen und tierische Verbündete damit auslösen.","cards":[{"name":"Lucky the Pizza Dog","qty":1},{"name":"Guerrilla Gorilla","qty":1},{"name":"Tigra, Feline Fury","qty":1},{"name":"Wakandan Tusker","qty":1},{"name":"Ant-Man's Army","qty":1},{"name":"Tippy-Toe, Terrific Partner","qty":1},{"name":"Pet Avengers","qty":1},{"name":"Savage Land Dinosaur","qty":1},{"name":"Go Nuts!","qty":1},{"name":"Scout the City","qty":1},{"name":"Beast Mode","qty":1},{"name":"Heroic Feast","qty":1}],"lands":[{"name":"Thriving Grove","qty":1},{"name":"Forest","qty":7}]},{"id":"great-lakes-avengers","name":"Great Lakes Avengers","group":"G","colors":["G"],"description":"Ungewöhnliche Helden bündeln und mit Team-Synergien dominieren.","cards":[{"name":"Guerrilla Gorilla","qty":1},{"name":"Doorman","qty":1},{"name":"Mister Immortal","qty":1},{"name":"Tippy-Toe, Terrific Partner","qty":1},{"name":"Flatman","qty":1},{"name":"The Unbeatable Squirrel Girl","qty":1},{"name":"Big Bertha","qty":1},{"name":"Savage Land Dinosaur","qty":1},{"name":"Rapid Rescue","qty":1},{"name":"Go Nuts!","qty":1},{"name":"Beast Mode","qty":1},{"name":"Training Regimen","qty":1}],"lands":[{"name":"Thriving Grove","qty":1},{"name":"Forest","qty":7}]},{"id":"incredible","name":"Incredible","group":"G","colors":["G"],"description":"+1/+1-Marken aufbauen und mit Hulk immer weiter skalieren.","cards":[{"name":"Brawn, Amadeus Cho","qty":1},{"name":"Guerrilla Gorilla","qty":1},{"name":"She-Hulk, Attorney-at-Law","qty":1},{"name":"Hulk, Strongest There Is","qty":1},{"name":"Abomination, Terrifying Titan","qty":1},{"name":"Doc Samson, Super Psychiatrist","qty":1},{"name":"Savage Land Dinosaur","qty":1},{"name":"Giant Growth","qty":1},{"name":"Hulk's Thunderclap","qty":1},{"name":"Origin of the Hulk","qty":1},{"name":"Go Nuts!","qty":1},{"name":"Super Strength","qty":1}],"lands":[{"name":"Thriving Grove","qty":1},{"name":"Forest","qty":7}]},{"id":"rampaging","name":"Rampaging","group":"G","colors":["G"],"description":"Trample und wachsende +1/+1-Marken für Druck nutzen.","cards":[{"name":"Serpent Specialist","qty":1},{"name":"Knight of Wundagore","qty":1},{"name":"Bushmaster, Coiled Henchman","qty":1},{"name":"Titania, Rugged Rumbler","qty":1},{"name":"Powerful Broker","qty":1},{"name":"Mister Hyde, Monster Within","qty":1},{"name":"Atlas, Sizable Stooge","qty":1},{"name":"Rhino, Terrible Trampler","qty":1},{"name":"Rhino's Rampage","qty":1},{"name":"Beast Mode","qty":1},{"name":"Colossal Collision","qty":1},{"name":"Claim the Kingdom","qty":1}],"lands":[{"name":"Thriving Grove","qty":1},{"name":"Forest","qty":7}]},{"id":"savage-lands","name":"Savage Lands","group":"G","colors":["G"],"description":"Dinosaurier und Savage-Lands-Kreaturen gemeinsam ins Feld bringen.","cards":[{"name":"Reptil, Dinomorpher","qty":1},{"name":"Lurking Lizards","qty":1},{"name":"Moon-Boy, Dino Rider","qty":1},{"name":"Gert and Old Lace, Runaways","qty":1},{"name":"Devil Dinosaur","qty":1},{"name":"Ka-Zar of the Savage Land","qty":1},{"name":"Sauron, Dino Devotee","qty":1},{"name":"Savage Land Dinosaur","qty":1},{"name":"Commune with Dinosaurs","qty":1},{"name":"Go Nuts!","qty":1},{"name":"Accelerated Evolution","qty":1},{"name":"Terrific Team-Up","qty":1}],"lands":[{"name":"Thriving Grove","qty":1},{"name":"Savage Lands","qty":1},{"name":"Forest","qty":6}]},{"id":"tenacious","name":"Tenacious","group":"G","colors":["G"],"description":"Eigenes Deck millen und vom großen Friedhof profitieren.","cards":[{"name":"Undercover Skrull","qty":1},{"name":"White Tiger, Amulet Keeper","qty":1},{"name":"Hellcat, Undying Vigilante","qty":1},{"name":"Gert and Old Lace, Runaways","qty":1},{"name":"Voracious Brood","qty":1},{"name":"Pet Avengers","qty":1},{"name":"Savage Land Dinosaur","qty":1},{"name":"Return of the Mole Man","qty":1},{"name":"Scout the City","qty":1},{"name":"Call Damage Control","qty":1},{"name":"Accelerated Evolution","qty":1},{"name":"Punishing Punch","qty":1}],"lands":[{"name":"Thriving Grove","qty":1},{"name":"Terramorphic Expanse","qty":1},{"name":"Forest","qty":6}]},{"id":"towering","name":"Towering","group":"G","colors":["G"],"description":"Kreaturen mit Stärke 4 oder mehr gezielt unterstützen.","cards":[{"name":"Reptil, Dinomorpher","qty":1},{"name":"Stature, Young Avenger","qty":1},{"name":"Goliath, Mass Manipulator","qty":1},{"name":"Ms. Marvel, Elastic Ally","qty":1},{"name":"Ant-Man, Reformed Rogue","qty":1},{"name":"Atlas, Sizable Stooge","qty":1},{"name":"Giant-Man, Gargantuan Genius","qty":1},{"name":"Spider-Rex, Daring Dino","qty":1},{"name":"Giant Growth","qty":1},{"name":"Rapid Rescue","qty":1},{"name":"Terrific Team-Up","qty":1},{"name":"Colossal Collision","qty":1}],"lands":[{"name":"Thriving Grove","qty":1},{"name":"Forest","qty":7}]},{"id":"trained","name":"Trained","group":"G","colors":["G"],"description":"Kreaturen trainieren und +1/+1-Marken stapeln.","cards":[{"name":"Serpent Specialist","qty":1},{"name":"White Tiger, Ava Ayala","qty":1},{"name":"Undercover Skrull","qty":1},{"name":"Hercules, Prince of Power","qty":1},{"name":"She-Hulk, Attorney-at-Law","qty":1},{"name":"Pet Avengers","qty":1},{"name":"Shang-Chi, Martial Mentor","qty":1},{"name":"Wakandan Royal Guard","qty":1},{"name":"Advancing the Spirit","qty":1},{"name":"Restorative Technique","qty":1},{"name":"Punishing Punch","qty":1},{"name":"Colossal Collision","qty":1}],"lands":[{"name":"Thriving Grove","qty":1},{"name":"Forest","qty":7}]},{"id":"uncanny","name":"Uncanny","group":"G","colors":["G"],"description":"Mutanten und X-Men zusammenbringen und gegenseitig verstärken.","cards":[{"name":"Black Tom Cassidy","qty":1},{"name":"Darwin, Adaptive Mutant","qty":1},{"name":"Wolfsbane, Highland Hero","qty":1},{"name":"X-23, Deadly Weapon","qty":1},{"name":"Wolverine, Claws Out","qty":1},{"name":"Beast, Erudite Aerialist","qty":1},{"name":"Colossus, Steel Stalwart","qty":1},{"name":"Storm, Shaker of Skies","qty":1},{"name":"Go Nuts!","qty":1},{"name":"Accelerated Evolution","qty":1},{"name":"Colossal Collision","qty":1},{"name":"Training Regimen","qty":1}],"lands":[{"name":"Thriving Grove","qty":1},{"name":"Forest","qty":7}]},{"id":"wild","name":"Wild","group":"G","colors":["G"],"description":"Mehrere Länder pro Zug spielen und Land-Synergien ausnutzen.","cards":[{"name":"Hellcat, Undying Vigilante","qty":1},{"name":"White Tiger, Amulet Keeper","qty":1},{"name":"The Fabulous Frog-Man","qty":1},{"name":"Gert and Old Lace, Runaways","qty":1},{"name":"Mole Man, Moloid Master","qty":1},{"name":"Hit-Monkey","qty":1},{"name":"Ka-Zar of the Savage Land","qty":1},{"name":"Claim the Kingdom","qty":1},{"name":"Accelerated Evolution","qty":1},{"name":"Restorative Technique","qty":1},{"name":"Colossal Collision","qty":1}],"lands":[{"name":"Terramorphic Expanse","qty":1},{"name":"Thriving Grove","qty":1},{"name":"Forest","qty":7}]}]}
