{"collection":"Magic: The Gathering | Marvel Super Heroes Jumpstart","setCode":"MSH","group":"B","decks":[{"id":"armed","name":"Armed","group":"B","colors":["B"],"description":"Ausrüstung an Schergen anlegen und Kampfwerte verbessern.","cards":[{"name":"Whiplash, Vengeful Engineer","qty":1},{"name":"Swordsman, Sharp Scoundrel","qty":1},{"name":"Red Room Recruit","qty":1},{"name":"Ronin, Shadow Stalker","qty":1},{"name":"Kingpin's Enforcers","qty":1},{"name":"Armed Assailant","qty":1},{"name":"U.S.Agent, John Walker","qty":1},{"name":"HYDRA Disintegrator","qty":1},{"name":"Stolen Stark Tech","qty":1},{"name":"Voltaic Whip","qty":1},{"name":"Hour of Defeat","qty":1},{"name":"Swordsman's Steel","qty":1}],"lands":[{"name":"Thriving Moor","qty":1},{"name":"Swamp","qty":7}]},{"id":"doom","name":"DOOM","group":"B","colors":["B"],"description":"Doctor Doom und Doomsday zu einem explosiven Finish kombinieren.","cards":[{"name":"Project Deathlok Soldier","qty":1},{"name":"Common Crook","qty":1},{"name":"Doom's Servo-Guards","qty":1},{"name":"Doombot Harbinger","qty":1},{"name":"Ninja of the Hand","qty":1},{"name":"Doctor Doom, Unrivaled","qty":1},{"name":"Roxxon Brutes","qty":1},{"name":"Dark Ritual","qty":1},{"name":"Doom Blade","qty":1},{"name":"Deadly Dispute","qty":1},{"name":"Doomfall","qty":1},{"name":"Doomsday","qty":1}],"lands":[{"name":"Thriving Moor","qty":1},{"name":"Swamp","qty":7}]},{"id":"hydra","name":"HYDRA","group":"B","colors":["B"],"description":"Allein angreifen, infiltrieren und entbehrliche Schergen opfern.","cards":[{"name":"Bob, Reluctant HYDRA Agent","qty":1},{"name":"Viper, Cruel Conspirator","qty":1},{"name":"Agents of HYDRA","qty":1},{"name":"HYDRA Troopers","qty":1},{"name":"Baron Strucker, HYDRA Overlord","qty":1},{"name":"Arnim Zola, Bio-Fanatic","qty":1},{"name":"Crossbones, Malicious Mercenary","qty":1},{"name":"HYDRA Disintegrator","qty":1},{"name":"Dark Deed","qty":1},{"name":"Cruel Alliance","qty":1},{"name":"HYDRA Infiltration","qty":1},{"name":"Infernal Rebirth","qty":1}],"lands":[{"name":"Thriving Moor","qty":1},{"name":"Swamp","qty":7}]},{"id":"lethal","name":"Lethal","group":"B","colors":["B"],"description":"Deathtouch verteilen und Black Widows Präzision nutzen.","cards":[{"name":"Red Room Recruit","qty":1},{"name":"White Widow, Yelena Belova","qty":1},{"name":"Ninja of the Hand","qty":1},{"name":"Venomized Cat","qty":1},{"name":"Black Widow, Deadly Hunter","qty":1},{"name":"Titanium Man","qty":1},{"name":"Venom, Evil Unleashed","qty":1},{"name":"Stolen Stark Tech","qty":1},{"name":"Widow's Bite","qty":1},{"name":"Hour of Defeat","qty":1},{"name":"Origin of Black Widow","qty":1},{"name":"Infernal Rebirth","qty":1}],"lands":[{"name":"Thriving Moor","qty":1},{"name":"Swamp","qty":7}]},{"id":"masters-of-evil","name":"Masters of Evil","group":"B","colors":["B"],"description":"Mit jedem weiteren Master of Evil den nächsten verstärken.","cards":[{"name":"Boomerang, Blade Flinger","qty":1},{"name":"Yellowjacket, Heartless Marauder","qty":1},{"name":"Titania, Rugged Rumbler","qty":1},{"name":"Klaw, Sonic Subjugator","qty":1},{"name":"Crimson Cowl, Master of Evil","qty":1},{"name":"Tiger Shark, Abyssal Hunter","qty":1},{"name":"Radioactive Man","qty":1},{"name":"The Masters of Evil","qty":1},{"name":"Villainous Syndication","qty":1},{"name":"Cruel Alliance","qty":1},{"name":"Visions of Villainy","qty":1},{"name":"Hour of Defeat","qty":1}],"lands":[{"name":"Thriving Moor","qty":1},{"name":"Swamp","qty":7}]},{"id":"mayhem","name":"Mayhem","group":"B","colors":["B"],"description":"Karten abwerfen und Zauber aus dem Friedhof verwerten.","cards":[{"name":"Project Deathlok Soldier","qty":1},{"name":"Red Room Recruit","qty":1},{"name":"Yellowjacket, Heartless Marauder","qty":1},{"name":"Swarm, Being of Bees","qty":1},{"name":"Inner Demons Gangsters","qty":1},{"name":"Roxxon Brutes","qty":1},{"name":"Green Goblin, Back for More","qty":1},{"name":"Pumpkin Bombardment","qty":1},{"name":"Alien Symbiosis","qty":1},{"name":"Daily Bugle Newspaper","qty":1},{"name":"Rocket-Powered Goblin Glider","qty":1},{"name":"Sadistic Slash","qty":1}],"lands":[{"name":"Thriving Moor","qty":1},{"name":"Swamp","qty":7}]},{"id":"returned","name":"Returned","group":"B","colors":["B"],"description":"Eigenes Deck millen und Kreaturen aus dem Friedhof zurückholen.","cards":[{"name":"Project Deathlok Soldier","qty":1},{"name":"Doom's Servo-Guards","qty":1},{"name":"Undead Hand Ninja","qty":1},{"name":"Songbird, Sonic Screamer","qty":1},{"name":"Arnim Zola, Bio-Fanatic","qty":1},{"name":"Grim Reaper, Lethal Legionnaire","qty":1},{"name":"Unliving Legionnaire","qty":1},{"name":"Ultimo, Civilization's End","qty":1},{"name":"Minion Missile","qty":1},{"name":"Grim Reaper's Scythe","qty":1},{"name":"Too Evil to Stay Dead","qty":1},{"name":"Infernal Rebirth","qty":1}],"lands":[{"name":"Thriving Moor","qty":1},{"name":"Swamp","qty":7}]},{"id":"street-level-villains","name":"Street Level Villains","group":"B","colors":["B"],"description":"Schergen und Treasure opfern, um Vorteil zu erzeugen.","cards":[{"name":"Agents of HYDRA","qty":1},{"name":"Common Crook","qty":1},{"name":"Hammerhead, Maggia Boss","qty":1},{"name":"Kingpin's Enforcers","qty":1},{"name":"Tombstone, Career Criminal","qty":1},{"name":"Kingpin, Wilson Fisk","qty":1},{"name":"Madame Masque","qty":1},{"name":"Count Nefaria","qty":1},{"name":"Minion Missile","qty":1},{"name":"Deadly Dispute","qty":1},{"name":"Criminal Enterprise","qty":1},{"name":"The Spot's Portal","qty":1}],"lands":[{"name":"Thriving Moor","qty":1},{"name":"Swamp","qty":7}]},{"id":"thunderbolts","name":"Thunderbolts","group":"B","colors":["B"],"description":"Lebenspunkte gewinnen, conniven und Thunderbolts hochfahren.","cards":[{"name":"MACH-1, Swooping Scoundrel","qty":1},{"name":"Songbird, Sonic Screamer","qty":1},{"name":"Fixer, Techno Terror","qty":1},{"name":"Valentina Allegra de Fontaine","qty":1},{"name":"Citizen V, Helmut Zemo","qty":1},{"name":"Atlas, Sizable Stooge","qty":1},{"name":"Moonstone, Harsh Mistress","qty":1},{"name":"Roxxon Brutes","qty":1},{"name":"Stolen Stark Tech","qty":1},{"name":"Eerie Gravestone","qty":1},{"name":"Cruel Alliance","qty":1},{"name":"Void Helix","qty":1}],"lands":[{"name":"Thriving Moor","qty":1},{"name":"Swamp","qty":7}]},{"id":"ultron","name":"Ultron","group":"B","colors":["B"],"description":"Artefakte im Friedhof in neue Robot-Truppen umwandeln.","cards":[{"name":"Project Deathlok Soldier","qty":1},{"name":"Doom's Servo-Guards","qty":1},{"name":"Ultron's Auxiliary","qty":1},{"name":"Doombot Harbinger","qty":1},{"name":"Ultron Drone","qty":1},{"name":"Ultron the Annihilator","qty":1},{"name":"Victor Mancha, Runaway","qty":1},{"name":"Minion Missile","qty":1},{"name":"Stolen Stark Tech","qty":1},{"name":"Eerie Gravestone","qty":1},{"name":"Dark Deed","qty":1},{"name":"Robot Domination","qty":1}],"lands":[{"name":"Thriving Moor","qty":1},{"name":"Swamp","qty":7}]}]}
