{"collection":"Magic: The Gathering | Marvel Super Heroes Jumpstart","setCode":"MSH","group":"M","decks":[{"id":"fantastic","name":"Fantastic","group":"M","colors":["W","U","R","G"],"description":"Die Fantastic Four zusammenführen und mehrfarbige Synergien nutzen.","cards":[{"name":"Human Torch, Johnny Storm","qty":1},{"name":"H.E.R.B.I.E. Scout Unit","qty":1},{"name":"Mister Fantastic, Reed Richards","qty":1},{"name":"Invisible Woman, Sue Storm","qty":1},{"name":"The Thing, Ben Grimm","qty":1},{"name":"The Fantastic Four","qty":1},{"name":"Farseek","qty":1},{"name":"Daily Bugle Newspaper","qty":1},{"name":"Wall Off","qty":1},{"name":"Fantastic Bounce","qty":1},{"name":"Inspired Fire","qty":1},{"name":"Thing Swing","qty":1}],"lands":[{"name":"Baxter Building","qty":1},{"name":"Thriving Grove","qty":1},{"name":"Pym Technologies","qty":1},{"name":"Forest","qty":1},{"name":"Plains","qty":1},{"name":"Island","qty":1},{"name":"Mountain","qty":1},{"name":"Terramorphic Expanse","qty":1}]}]}
